{
  "schema_version": "1",
  "job_id": "fixture-similarity-blast-local",
  "capability": "similarity.blast.local.v1",
  "inputs": {"query": "../sequences/tiny.fa", "reference": "../sequences/tiny.fa"},
  "execution": {"mode": "local-cpu"},
  "parameters": {"output": "../../../target/test-results/blast-local.tsv", "program": "blastn", "threads": 2, "outfmt": 6}
}
