{
  "schema_version": "1",
  "job_id": "fixture-enrichment-visualize",
  "capability": "enrichment.visualize.v1",
  "inputs": {
    "genes": "../functional/genes.txt",
    "associations": "../functional/associations.tsv"
  },
  "execution": {"mode": "local-cpu"},
  "parameters": {
    "output": "../../../target/test-results/enrichment-network.svg",
    "kind": "go",
    "style": "network",
    "min_overlap": 1,
    "max_terms": 10
  }
}
