{
  "schema_version": "1",
  "job_id": "fixture-protein-domain-visualize",
  "capability": "protein.domain.visualize.v1",
  "inputs": {"domains": "../protein-domains/interproscan.tsv"},
  "execution": {"mode": "local-cpu"},
  "parameters": {
    "output": "../../../target/test-results/protein-domains.svg",
    "max_sequences": 10,
    "max_domains": 50
  }
}
