{
  "schema_version": "1",
  "job_id": "fixture-motif-meme",
  "capability": "motif.meme.v1",
  "inputs": {"fasta": "../sequences/tiny.fa"},
  "execution": {"mode": "local-cpu"},
  "parameters": {"output": "../../../target/test-results/motifs.meme", "alphabet": "dna", "distribution": "zoops", "motif_count": 3, "minimum_width": 4, "maximum_width": 12, "threads": 2}
}
