{
  "schema_version": "1",
  "job_id": "fixture-motif-mast",
  "capability": "motif.mast.v1",
  "inputs": {"motif": "../sequences/tiny.fa", "sequences": "../sequences/tiny.fa"},
  "execution": {"mode": "local-cpu"},
  "parameters": {"output": "../../../target/test-results/mast.txt", "evalue": 1e-5, "threads": 2, "hit_list": true}
}