{
  "schema_version": "1",
  "job_id": "fixture-phylogeny-distance",
  "capability": "phylogeny.distance.v1",
  "inputs": {"alignment": "../phylogeny/alignment.fa"},
  "execution": {"mode": "local-cpu"},
  "parameters": {"output": "../../../target/test-results/phylogeny-distance.tsv", "model": "p-distance"}
}