{
  "schema_version": "1",
  "job_id": "fixture-annotation-gxf-to-bed",
  "capability": "annotation.gxf.to-bed.v1",
  "inputs": {
    "annotation": "../annotation/genes.gff3"
  },
  "execution": {
    "mode": "local-cpu"
  },
  "parameters": {
    "output": "genes.bed",
    "feature_types": ["gene"]
  }
}