{
    "schema_version": "1",
    "job_id": "fixture-phylogeny-tree-visualize",
    "capability": "phylogeny.tree.visualize.v1",
    "inputs": {
        "tree": "../phylogeny/tree.nwk"
    },
    "execution": {
        "mode": "local-cpu"
    },
    "parameters": {
        "output": "../../../target/test-results/tree-visualize.svg",
        "width": 800,
        "height": 600,
        "show_branch_lengths": false
    }
}