{
  "schema_version": "1",
  "job_id": "fixture-phylogeny-iqtree",
  "capability": "phylogeny.iqtree.v1",
  "inputs": {"alignment": "../sequences/tiny.fa"},
  "execution": {"mode": "local-cpu"},
  "parameters": {"output": "../../../target/test-results/iqtree.nwk", "threads": 2, "model": "MFP", "seed": 7}
}
