{
  "schema_version": "1",
  "job_id": "fixture-interval-subtract",
  "capability": "interval.subtract.v1",
  "inputs": {
    "left-bed": "../interval-intersect/left.bed",
    "right-bed": "../interval-intersect/right.bed"
  },
  "execution": {
    "mode": "local-cpu"
  },
  "parameters": {
    "output": "../../../target/test-results/interval-subtract.bed"
  }
}
