{
  "schema_version": "1",
  "job_id": "fixture-enrichment-kegg",
  "capability": "enrichment.kegg.v1",
  "inputs": {"genes": "../functional/genes.txt", "associations": "../functional/associations.tsv"},
  "execution": {"mode": "local-cpu"},
  "parameters": {"include_genes": true, "max_terms": 10}
}
