{
  "schema_version": "1",
  "job_id": "fixture-similarity-diamond",
  "capability": "similarity.diamond.v1",
  "inputs": {"query": "../sequences/tiny.fa", "reference": "../sequences/tiny.fa"},
  "execution": {"mode": "local-cpu"},
  "parameters": {"output": "../../../target/test-results/diamond.tsv", "mode": "blastp", "threads": 2, "outfmt": 6}
}
